{
  "title": "Simple, transparent pricing",
  "subtitle": "Choose the plan that fits your needs. Upgrade or downgrade at any time.",
  "showToggle": true,
  "tiers": [
    {
      "name": "Starter",
      "description": "Perfect for individuals and small projects",
      "monthlyPrice": 9,
      "annualPrice": 7,
      "currency": "$",
      "features": [
        {
          "text": "5 projects",
          "included": true
        },
        {
          "text": "1GB storage",
          "included": true
        },
        {
          "text": "Email support",
          "included": true
        },
        {
          "text": "Basic analytics",
          "included": true
        },
        {
          "text": "API access",
          "included": false
        },
        {
          "text": "SSO",
          "included": false
        }
      ],
      "ctaLabel": "Get Started",
      "highlighted": false
    },
    {
      "name": "Pro",
      "description": "Best for growing teams and businesses",
      "monthlyPrice": 29,
      "annualPrice": 24,
      "currency": "$",
      "features": [
        {
          "text": "50 projects",
          "included": true
        },
        {
          "text": "10GB storage",
          "included": true
        },
        {
          "text": "Priority support",
          "included": true
        },
        {
          "text": "Advanced analytics",
          "included": true
        },
        {
          "text": "API access",
          "included": true
        },
        {
          "text": "SSO",
          "included": false
        }
      ],
      "ctaLabel": "Get Started",
      "highlighted": true,
      "badge": "Most Popular"
    },
    {
      "name": "Enterprise",
      "description": "For large organizations with advanced needs",
      "monthlyPrice": 99,
      "annualPrice": 79,
      "currency": "$",
      "features": [
        {
          "text": "Unlimited projects",
          "included": true
        },
        {
          "text": "Unlimited storage",
          "included": true
        },
        {
          "text": "24/7 support",
          "included": true
        },
        {
          "text": "Custom analytics",
          "included": true
        },
        {
          "text": "API + Webhooks",
          "included": true
        },
        {
          "text": "SSO",
          "included": true
        }
      ],
      "ctaLabel": "Contact Sales",
      "highlighted": false
    }
  ],
  "appearance": {
    "animation": {
      "entrance": "fade",
      "duration": 300,
      "delay": 0
    },
    "responsive": {
      "padding": {
        "mobile": "16px",
        "tablet": "20px",
        "desktop": "24px"
      }
    }
  }
}
